{
  "schema_version": "0.1",
  "agent_id": "volleyd",
  "wall_time": "2026-10-23T09:00:00.000Z",
  "channel": "_waves/events",
  "type": "task_queued",
  "payload": {
    "wave": "w1",
    "seq": 170,
    "at": "2026-10-23T09:00:00.000Z",
    "task": "train-1",
    "data": {
      "issue": 0,
      "synthetic": true,
      "title": "Merge train 1: T1, T2, T4",
      "train": {
        "members": [
          {
            "task": "T1",
            "pr": 201,
            "head": "1a2b3c4d5e6f7a8b9c0d1e2f3a4b5c6d7e8f9a0b"
          },
          {
            "task": "T2",
            "pr": 203,
            "head": "2b3c4d5e6f7a8b9c0d1e2f3a4b5c6d7e8f9a0b1c"
          },
          {
            "task": "T4",
            "pr": 207,
            "head": "3c4d5e6f7a8b9c0d1e2f3a4b5c6d7e8f9a0b1c2d"
          }
        ]
      }
    }
  }
}
