{
  "schema_version": "0.1",
  "agent_id": "w1-t1-implementer-1",
  "parent_id": "volleyd",
  "wall_time": "2026-10-18T12:05:00.000Z",
  "channel": "progress",
  "type": "awaiting_input",
  "payload": {
    "notification_type": "idle_prompt",
    "text": "Claude is waiting for your input",
    "background_wait": true,
    "source": "harness-hook",
    "seq": 8,
    "hook_event": "Notification"
  },
  "correlation_id": null
}
