{
  "schema_version": "0.1",
  "agent_id": "volleyd",
  "wall_time": "2026-10-18T14:02:11.000Z",
  "channel": "_waves/state",
  "type": "wave_state",
  "payload": {
    "wave": "w1",
    "version": 1,
    "owner": "coordinator-ab12",
    "repo": "example-org/example-repo",
    "release_branch": "release/2026-10-18-example",
    "status": "running",
    "tasks": [
      {
        "id": "T1",
        "issue": 101,
        "stage": "done",
        "agents": {
          "implementer": "w1-t1-implementer-1"
        }
      },
      {
        "id": "T2",
        "issue": 102,
        "stage": "merge_ready",
        "agents": {
          "implementer": "w1-t2-implementer-1"
        },
        "pr": {
          "number": 8,
          "url": "https://github.com/example-org/example-repo/pull/8",
          "head_sha": "5be0c2a1f9d4",
          "ci": "green"
        },
        "evidence_path": "waves/w1/evidence/T2.md"
      },
      {
        "id": "T3",
        "issue": 103,
        "stage": "fixup",
        "agents": {
          "implementer": "w1-t3-implementer-1",
          "rebase": "w1-t3-rebase-1"
        },
        "pr": {
          "number": 9,
          "url": "https://github.com/example-org/example-repo/pull/9",
          "head_sha": "77ac0e3d12b8",
          "ci": "running"
        }
      },
      {
        "id": "T4",
        "issue": 104,
        "stage": "merge_ready",
        "agents": {
          "implementer": "w1-t4-implementer-1"
        },
        "evidence_path": "waves/w1/evidence/T4.md"
      }
    ],
    "open_decisions": [],
    "gates": [
      "T2",
      "T4"
    ],
    "spec": {
      "version": 1,
      "release_branch": "release/2026-10-18-example",
      "model": "claude-opus-5-5",
      "pipeline": [
        "implement",
        [
          "spec_review",
          "quality_review"
        ],
        "fixup",
        "merge_ready"
      ],
      "tasks": {
        "T1": {
          "issue": 101,
          "title": "SPEC + schemas",
          "after": []
        },
        "T2": {
          "issue": 102,
          "title": "Hooks package",
          "after": []
        },
        "T3": {
          "issue": 103,
          "title": "Daemon foundation",
          "after": []
        },
        "T4": {
          "issue": 104,
          "title": "CLI",
          "after": [
            "T1"
          ]
        }
      }
    },
    "coordinator": {
      "agent_id": "coordinator-ab12",
      "state": "working",
      "last_seen": "2026-10-18T14:02:00.000Z"
    },
    "effective_config": {
      "hard_ceiling": 12,
      "spawn_budget_multiplier": 3
    },
    "brief_preface": {
      "path": "/srv/example-repo/.volley/brief-preface.md",
      "sha256": "3f8a1c6e0b9d2f47a5e8c1d06b3e9f2a7c4d8e1f0a6b5c2d9e3f7a1b8c4d0e6f",
      "bytes": 912
    },
    "updated_at": "2026-10-18T14:02:11.000Z",
    "merge_queue": [
      {
        "task": "T3",
        "state": "updating",
        "since": "2026-10-18T13:40:02.000Z"
      },
      {
        "task": "T2",
        "state": "queued",
        "since": "2026-10-18T13:51:30.000Z"
      },
      {
        "task": "T4",
        "state": "refused",
        "since": "2026-10-18T13:22:47.000Z"
      }
    ]
  }
}
