{
  "schema_version": "0.1",
  "agent_id": "volleyd",
  "wall_time": "2026-10-24T09:00:00.000Z",
  "channel": "_waves/events",
  "type": "roles_changed",
  "payload": {
    "wave": "_system",
    "seq": 42,
    "at": "2026-10-24T09:00:00.000Z",
    "data": {
      "by": "volleyd-defaults",
      "roles": {
        "broker": {
          "machine": "mac",
          "address": {
            "ssh": null,
            "mqtt_port": 1883,
            "ws_port": 9001
          },
          "lan": false
        },
        "supervisor": {
          "machine": "mac"
        },
        "desk": {
          "machine": "mac",
          "url": "http://mac.local:5199"
        },
        "version": 1,
        "updated_at": "2026-10-24T09:00:00.000Z",
        "updated_by": "volleyd-defaults"
      }
    }
  }
}
