{
  "schema_version": "0.1",
  "agent_id": "volleyd",
  "wall_time": "2026-10-18T14:06:01.000Z",
  "channel": "_system/claude-accounts",
  "type": "claude_account",
  "payload": {
    "account": "primary@gpu-box",
    "five_hour": { "pct": 95, "resets_at": "2026-10-18T18:10:00.000Z" },
    "weekly": null,
    "agents": ["w1-t1-spec-reviewer-1"],
    "waves": ["w1"],
    "sampled_at": "2026-10-18T14:06:00.000Z",
    "sampled_by": "w1-t1-spec-reviewer-1"
  }
}
