{
  "schema_version": "0.1",
  "agent_id": "w1-t1-implementer-1",
  "parent_id": "volleyd",
  "wall_time": "2026-10-18T12:04:00.000Z",
  "channel": "progress",
  "type": "idle",
  "payload": {
    "text": "The migration needs a schema change. Should I add the column to the shared table or create a new one?",
    "source": "harness-hook",
    "seq": 6,
    "hook_event": "Stop"
  },
  "correlation_id": null
}
