{
  "schema_version": "0.1",
  "agent_id": "volleyd",
  "wall_time": "2026-10-19T12:06:00.000Z",
  "channel": "_waves/events",
  "type": "desk_password_issued",
  "payload": {
    "wave": "_system",
    "seq": 44,
    "at": "2026-10-19T12:06:00.000Z",
    "data": {
      "by": "admin-0123abcd"
    }
  }
}
